{
  "$schema": "https://json-schema.org/draft/2020-12/schema",
  "$id": "https://agenticharness.local/schemas/run-summary.schema.json",
  "title": "Run Summary",
  "type": "object",
  "additionalProperties": false,
  "required": [
    "schema_version",
    "task_id",
    "run_id",
    "created_at",
    "objective_summary",
    "artifact_refs",
    "final_verdict",
    "phases_completed"
  ],
  "properties": {
    "schema_version": { "const": "1.0" },
    "task_id": { "type": "string", "minLength": 1 },
    "run_id": { "type": "string", "minLength": 1 },
    "created_at": { "type": "string", "format": "date-time" },
    "objective_summary": { "type": "string", "minLength": 1 },
    "artifact_refs": {
      "type": "object",
      "additionalProperties": false,
      "required": ["scope"],
      "properties": {
        "scope": { "type": "string", "minLength": 1 },
        "findings": { "type": "string", "minLength": 1 },
        "implementation_report": { "type": "string", "minLength": 1 },
        "verification_report": { "type": "string", "minLength": 1 },
        "checkpoint": { "type": "string", "minLength": 1 }
      }
    },
    "final_verdict": { "enum": ["pass", "fail", "blocked", "inconclusive"] },
    "phases_completed": {
      "type": "array",
      "uniqueItems": true,
      "items": { "enum": ["discovery", "research", "implementation", "verification"] }
    },
    "phases_reused": {
      "type": "array",
      "uniqueItems": true,
      "items": { "enum": ["discovery", "research", "implementation", "verification"] }
    },
    "phases_restarted": {
      "type": "array",
      "uniqueItems": true,
      "items": { "enum": ["discovery", "research", "implementation", "verification"] }
    },
    "phases_skipped": {
      "type": "array",
      "uniqueItems": true,
      "items": { "const": "research" }
    },
    "lessons_learned_appended": {
      "type": "array",
      "maxItems": 5,
      "items": { "type": "string", "minLength": 1 }
    },
    "memory_loaded": { "type": "boolean" },
    "memory_influenced_run": { "type": "boolean" },
    "memory_refs_used": {
      "type": "array",
      "uniqueItems": true,
      "items": { "type": "string", "minLength": 1 }
    },
    "remaining_risks": {
      "type": "array",
      "items": { "type": "string", "minLength": 1 }
    },
    "follow_up_actions": {
      "type": "array",
      "items": { "type": "string", "minLength": 1 }
    },
    "duration_seconds": { "type": "number", "minimum": 0 },
    "usage_summary_ref": { "type": "string", "minLength": 1 }
  },
  "if": {
    "properties": { "memory_influenced_run": { "const": true } },
    "required": ["memory_influenced_run"]
  },
  "then": {
    "properties": { "memory_refs_used": { "type": "array", "minItems": 1 } },
    "required": ["memory_refs_used"]
  },
  "$comment": "Semantic rule not enforced here (deferred to the future Python validator): each path present in artifact_refs must resolve to a file that actually exists and whose own task_id/run_id match this document's. Extension (2026-08-06, checkpoint/resume milestone): phases_reused and phases_restarted are optional and present only on a run-summary produced by a resumed run -- phases_reused lists phases whose canonical artifact was loaded from a prior checkpoint without redispatching an agent; phases_restarted lists phases that were incomplete at interruption and were run fresh in this process. Both are absent on an ordinary, non-resumed run. Extension (2026-08-06, memory-loop milestone): memory_loaded/memory_influenced_run/memory_refs_used are optional and, when present, must be produced by harness/orchestrator/memory.py's summarize_memory_events (via live_cli.py's summarize_memory operation), which derives them from the run's own retained policy-events.jsonl (a real memory_loaded event; real memory_applied events) rather than from an unchecked caller assertion. The if/then above gives this a schema-level floor: a run-summary may not claim memory_influenced_run: true while leaving memory_refs_used empty, though it cannot by itself confirm the listed refs correspond to genuine memory_applied events -- that check lives in summarize_memory_events, not in JSON Schema. Extension (2026-08-14, usage/cost-accounting milestone): usage_summary_ref is optional -- a repo-relative path to this run's own runs/<run_id>/usage-summary.json, produced only by harness/orchestrator/usage.py's build_run_usage_summary (via live_cli.py's build_usage_summary operation), never hand-authored. That document's own subagent_subtotal/orchestrator/coverage_status/full_pipeline_total fields carry the actual accounting detail; this field is only a pointer to it, exactly as checkpoint/verification_report are pointers elsewhere in this schema."
}
